{
  "phase_1_scope": "india-wide",
  "include_state_only_stories": false,
  "allow_state_with_national_significance": true,
  "scope_labels": [
    "national",
    "state",
    "local"
  ],
  "national_significance_markers": [
    "prime minister",
    "pm modi",
    "narendra modi",
    "president of india",
    "vice president",
    "parliament",
    "lok sabha",
    "rajya sabha",
    "supreme court",
    "chief justice",
    "election commission",
    "reserve bank",
    "sebi",
    "trai",
    "niti aayog",
    "centre",
    "central government",
    "cbi",
    "enforcement directorate",
    "nia",
    "national",
    "india-wide",
    "g20",
    "brics",
    "quad",
    "defence",
    "border",
    "lac",
    "loc",
    "inter-state",
    "indian railways",
    "railways",
    "national highway",
    "expressway",
    "airport",
    "port",
    "armed forces",
    "army",
    "navy",
    "air force",
    "disaster",
    "cyclone",
    "earthquake",
    "flood",
    "national security",
    "terror attack",
    "cyber attack",
    "train accident",
    "air crash",
    "pandemic",
    "epidemic",
    "election"
  ],
  "phase_2_states": {
    "telangana": {
      "enabled": false,
      "sources": []
    },
    "andhra-pradesh": {
      "enabled": false,
      "sources": []
    },
    "delhi": {
      "enabled": false,
      "sources": []
    },
    "maharashtra": {
      "enabled": false,
      "sources": []
    },
    "karnataka": {
      "enabled": false,
      "sources": []
    }
  },
  "multiple_states_scope": "national",
  "national_scope_terms": [
    "prime minister",
    "pm modi",
    "prime minister modi",
    "prime minister narendra modi",
    "narendra modi",
    "president of india",
    "droupadi murmu",
    "vice president",
    "jagdeep dhankhar",
    "chief justice",
    "chief justice of india",
    "cji",
    "election commissioner",
    "chief election commissioner",
    "finance minister",
    "home minister",
    "defence minister",
    "external affairs minister",
    "rbi governor",
    "governor of the reserve bank of india",
    "attorney general of india",
    "lok sabha speaker",
    "parliament",
    "lok sabha",
    "rajya sabha",
    "supreme court",
    "supreme court of india",
    "election commission",
    "election commission of india",
    "reserve bank",
    "reserve bank of india",
    "rbi",
    "sebi",
    "trai",
    "niti aayog",
    "centre",
    "central government",
    "union government",
    "government of india",
    "union cabinet",
    "cbi",
    "enforcement directorate",
    "nia",
    "ndma",
    "ndrf",
    "isro",
    "drdo",
    "upsc",
    "imd",
    "india meteorological department",
    "narcotics control bureau",
    "national",
    "india-wide",
    "national highway",
    "inter-state",
    "national security",
    "armed forces",
    "army",
    "navy",
    "air force",
    "indian railways",
    "border",
    "lac",
    "loc",
    "defence",
    "bharat",
    "india",
    "indian",
    "gdp",
    "inflation",
    "repo rate",
    "monetary policy",
    "union budget",
    "fiscal",
    "sensex",
    "nifty",
    "stock market",
    "economic growth",
    "rupee",
    "fdi",
    "capital markets",
    "current account",
    "msp",
    "gst council",
    "g20",
    "brics",
    "quad",
    "saarc",
    "united nations",
    "un security council",
    "india-china",
    "india-pakistan",
    "india-us",
    "india-russia",
    "india-eu",
    "galwan",
    "siachen",
    "kashmir",
    "external affairs",
    "mea",
    "foreign minister",
    "foreign secretary",
    "trade agreement",
    "fta",
    "sanctions",
    "diaspora"
  ],
  "significance_events": [
    "disaster",
    "cyclone",
    "earthquake",
    "flood",
    "floods",
    "heatwave",
    "heat wave",
    "landslide",
    "cloudburst",
    "drought",
    "cold wave",
    "avalanche",
    "terror attack",
    "cyber attack",
    "train accident",
    "air crash",
    "pandemic",
    "epidemic",
    "election",
    "national security"
  ],
  "city_to_state": {
    "new delhi": "delhi",
    "mumbai": "maharashtra",
    "kolkata": "west bengal",
    "chennai": "tamil nadu",
    "bengaluru": "karnataka",
    "hyderabad": "telangana",
    "ahmedabad": "gujarat",
    "pune": "maharashtra",
    "jaipur": "rajasthan",
    "lucknow": "uttar pradesh",
    "kanpur": "uttar pradesh",
    "nagpur": "maharashtra",
    "indore": "madhya pradesh",
    "bhopal": "madhya pradesh",
    "visakhapatnam": "andhra pradesh",
    "patna": "bihar",
    "vadodara": "gujarat",
    "ghaziabad": "uttar pradesh",
    "ludhiana": "punjab",
    "agra": "uttar pradesh",
    "nashik": "maharashtra",
    "ranchi": "jharkhand",
    "meerut": "uttar pradesh",
    "surat": "gujarat",
    "rajkot": "gujarat",
    "varanasi": "uttar pradesh",
    "srinagar": "jammu and kashmir",
    "amritsar": "punjab",
    "guwahati": "assam",
    "bhubaneswar": "odisha",
    "kochi": "kerala",
    "coimbatore": "tamil nadu",
    "madurai": "tamil nadu",
    "vijayawada": "andhra pradesh",
    "warangal": "telangana",
    "mysuru": "karnataka",
    "tiruchirappalli": "tamil nadu",
    "thiruvananthapuram": "kerala",
    "gurugram": "haryana",
    "noida": "uttar pradesh",
    "faridabad": "haryana",
    "chandigarh": "chandigarh",
    "dehradun": "uttarakhand",
    "shimla": "himachal pradesh",
    "panaji": "goa",
    "itanagar": "arunachal pradesh",
    "dispur": "assam",
    "imphal": "manipur",
    "agartala": "tripura",
    "aizawl": "mizoram",
    "kohima": "nagaland",
    "gangtok": "sikkim",
    "shillong": "meghalaya",
    "port blair": "andaman and nicobar islands"
  },
  "false_positive_patterns": [
    "indian wells",
    "indian ocean",
    "surat\\s+thani",
    "hyderabad(?:\\W*(?:\\bin\\b\\W*)?)pakistan"
  ]
}
